542045,241311,364730,241311,24200204,24000000,PREGÃO ELETRÔNICO,"Adesão a Ata de Registro de Preço n° 24431/2023, Pregão Eletrônico n° 0047/2022, cujo objeto é a aquisição de material de consumo - EXPEDIENTE (ESCRITÓRIO), para o HIAS",DESPESA.SEM.INSTRUMENTO.CONTRATUAL,Sem Íntegra,2024-01-25 00:00:00-03:00,2025-01-03 09:15:06-03:00,2024-12-31 00:00:00-03:00,52,549894,1305320,24001.006094/2024-64,198.0,0,578,Material de Expediente,46001003040202218,"Sem justificativa, devido ao cadastro ser de despesa sem instrumento contratual.",0.0,,Sem Pltrb,Sem DecDisp,Sem DecInexg,,2022/30217,19. REGISTRO DE PREÇO,12.496.814/0001-48,,198.0,0.0,198.0,0.0,2024-02-09T13:03:34.242-03:00,2025-05-21T10:30:48.287-03:00,,0.0,0.0,198.0,198.0,contrato,0,00364730,,12496814000148,VENCIDO,,PRINTE COMERCIO PARA IMPRESSÃO LTDA - EPP,321251,2025-01-01,2024-12-31T00:00:00.000-03:00,2024-01-25T00:00:00.000-03:00,,False,,,1211,False,,,
543337,241291,314674,241291,24200214,24000000,PREGÃO ELETRÔNICO,"Contratualização da ATA.2023/06461, por 12 meses no valor de R$ 8.220,00, para suprir as necessidades do HMCASG.",CONTRATO,20240202.1304465.Integra.CONTRATO.pdf,2024-01-25 00:00:00-03:00,2025-03-04 10:30:07-03:00,2025-02-28 00:00:00-03:00,51,476569,1304465,11068185/2023,8220.0,0,579,Outros,060562882022,Aquisição de material médico hospitalar.,0.0,,Sem Pltrb,Sem DecDisp,Sem DecInexg,,2022/18543,19. REGISTRO DE PREÇO,05.923.871/0001-09,53/2024,8220.0,0.0,8220.0,0.0,2024-02-27T13:03:40.193-03:00,2025-05-21T10:30:55.932-03:00,532024,0.0,0.0,0.0,0.0,contrato,0,00314674,,05923871000109,VENCIDO,2024-02-28T00:00:00.000-03:00,ALPHARAD MATERIAIS PARA DIAGNOSTICOS EIRELI - ME,321252,2025-03-01,2025-02-28T00:00:00.000-03:00,2024-02-28T00:00:00.000-03:00,,False,Antônio Augusto de Lima,,2396,False,,,
543395,241291,851445,241291,24200214,24000000,PREGÃO ELETRÔNICO,"Contratualização, por 12 (doze) meses, da ATA 06257/2023, no valor de R$ 41.081,00, para suprir as necessidades do HMCASG.",CONTRATO,20240202.1304529.Integra.CONTRATO.pdf,2024-01-25 00:00:00-03:00,2025-03-04 10:30:07-03:00,2025-02-28 00:00:00-03:00,51,648663,1304529,11246016/2023,41081.0,0,579,Outros,029470132022,Aquisição de material médico hospitalar.,0.0,,Sem Pltrb,Sem DecDisp,Sem DecInexg,,2022/10834,19. REGISTRO DE PREÇO,27.631.296/0001-03,45/2024,41081.0,0.0,41081.0,0.0,2024-02-27T13:04:16.973-03:00,2025-05-21T10:30:56.300-03:00,452024,0.0,0.0,0.0,0.0,contrato,0,00851445,,27631296000103,VENCIDO,2024-02-28T00:00:00.000-03:00,LAF MED DISTRIBUIDORA DE MEDICAMENTOS E MATERIAIS HOSPITALARES LTDA - EPP,321252,2025-03-01,2025-02-28T00:00:00.000-03:00,2024-02-28T00:00:00.000-03:00,,False,Antônio Augusto de Lima,,2454,False,,,
544302,228282,862451,220001,22000000,22000000,CARTA CONVITE,CONSTRUÇÃO DE SALA ADMINISTRATIVA E MURO FRONTAL ESCOLA INDÍGENA TREMEMBÉ MARIA VENÂNCIA(CREDE 3 - ACARAÚ),CONTRATO,20240129.1304075.Integra.CONTRATO.pdf,2024-01-25 00:00:00-03:00,2025-03-10 15:30:45-03:00,2025-03-07 00:00:00-03:00,51,707077,1304075,08275450/2023,141640.08,0,1771,Outros,082754502023,Melhoria da qualidade das escolas.,0.0,,Sem Pltrb,Sem DecDisp,Sem DecInexg,,2023/28850,01. PROCESSO LICITATÓRIO,26.161.655/0001-35,11/2023,141640.08,0.0,167360.56,0.0,2024-03-06T13:06:59.707-03:00,2025-10-01T16:29:07.273-03:00,112023,25720.48,0.0,167360.56,167360.56,contrato,0,00862451,,26161655000135,VENCIDO,2024-03-07T00:00:00.000-03:00,GYGAWATT SERVICOS DE MANUTENCAO LTDA,587815,2025-03-08,2025-03-07T00:00:00.000-03:00,2024-03-07T00:00:00.000-03:00,,False,ANA PATRICIA DOS SANTOS,,3337,False,,,ANA PATRICIA DOS SANTOS
543149,229184,901618,220001,22000000,22000000,CARTA CONVITE,CONSTRUÇÃO DE UMA SALA DE AULA - EEMTI JAIME TOMAZ DE AQUINO  - CREDE 9 - BEBERIBE,CONTRATO,20240202.1304651.Integra.CONTRATO.pdf,2024-01-26 00:00:00-03:00,2025-10-17 11:00:07-03:00,2025-12-16 00:00:00-03:00,51,694016,1304651,22001.038888/2023-81,147686.16,0,1771,Outros,22001038888202381,Melhoria da qualidade das escolas.,0.0,2025-05-21T00:00:00.000-03:00,Sem Pltrb,Sem DecDisp,Sem DecInexg,,2023/30368,01. PROCESSO LICITATÓRIO,41.539.524/0001-32,12/2023,147686.16,0.0,147686.16,0.0,2024-02-23T13:04:09.705-03:00,2025-10-17T13:13:55.885-03:00,122023,0.0,0.0,73843.08,73843.08,contrato,0,00901618,,41539524000132,EM EXECUÇÃO - NORMAL,2024-02-26T00:00:00.000-03:00,D S P DE OLIVEIRA EIRELI,670484,2025-10-15,2024-08-24T00:00:00.000-03:00,2024-02-26T00:00:00.000-03:00,,False,OCIVAN OLIVEIRA MOREIRA,0001-01-01,2225,False,,,OCIVAN OLIVEIRA MOREIRA
541315,460001,884853,460001,46000000,46000000,DISPENSA,Confecção e montagem de painel para exposição de galeria dos ex-secretários da SEPLAG,CONTRATO,20240129.1304062.Integra.CONTRATO.pdf,2024-01-26 00:00:00-03:00,2025-09-26 11:00:07-03:00,2024-04-25 00:00:00-03:00,51,676349,1304062,46001.000025/2024-80,9900.0,0,1666,Outros,46001000025202480,"Confecção de novos painéis, para compor o mobiliário histórico e cultural da SEPLAG.",0.0,0001-01-01T00:00:00.000-02:34,Sem Pltrb,20240129.1304062.Declaracao.Dispensa.CONTRATO.pdf,Sem DecInexg,,2024/00069,01. PROCESSO LICITATÓRIO,37.791.962/0001-16,001/2024,9900.0,0.0,9900.0,0.0,2024-02-02T13:04:50.635-03:00,2025-10-01T15:02:10.996-03:00,0012024,0.0,0.0,9900.0,9900.0,contrato,0,00884853,,37791962000116,VENCIDO,2024-02-05T00:00:00.000-03:00,VITORINO CONCEITO COMERCIO E SERVICO DE PRODUTOS DE LIMPEZA LTDA ,394669,2025-09-24,2024-04-25T00:00:00.000-03:00,2024-01-26T00:00:00.000-03:00,,False,Valdir Pinheiro Lima Filho,,621,False,,,Valdir Pinheiro Lima Filho
544380,241301,208560,241301,24200194,24000000,PREGÃO ELETRÔNICO,"Adesão procedente da Ata de Registro de Preço nº 2023/12382, Instrumento convocatório nº 2022/2017, Ordem de Compra nº 02460/2024, cujo o objeto é aquisição de material médico hospitalar e Ambulatorial para atender as necessidades do HGCC.",DESPESA.SEM.INSTRUMENTO.CONTRATUAL,Sem Íntegra,2024-01-26 00:00:00-03:00,2025-01-03 09:15:06-03:00,2024-12-31 00:00:00-03:00,52,327068,1308238,24001.005344/2024-49,7200.0,0,577,Outros,047070362022,"Esta aquisição é de extrema necessidade para o HGCC, que aderiu esta Ata de Registro de Preços, para dar continuidade de forma eficiente e eficaz, aos serviços desta unidade hospitalar.",0.0,,Sem Pltrb,Sem DecDisp,Sem DecInexg,,2022/16937,19. REGISTRO DE PREÇO,33.100.082/0004-48,,7200.0,0.0,7200.0,0.0,2024-03-07T13:02:51.767-03:00,2025-05-21T10:31:02.793-03:00,,0.0,0.0,7200.0,7200.0,contrato,0,00208560,,33100082000448,VENCIDO,,E. TAMUSSINO & CIA LTDA,321260,2025-01-01,2024-12-31T00:00:00.000-03:00,2024-01-26T00:00:00.000-03:00,,False,,,3414,False,,,
542224,240001,11639,240401,24200004,24000000,PREGÃO ELETRÔNICO,"Aquisição com Instalação/Montagem de Equipamento de telecomunicação, de Diagnóstico e Médico/Apoio Assistencial para o HRVJ.",CONTRATO,20240131.1304346.Integra.CONTRATO.pdf,2024-01-26 00:00:00-03:00,2025-02-19 10:30:08-03:00,2025-02-16 00:00:00-03:00,51,30305,1304346,08583765/2022,99458.0,0,1795,"Aquisição de Móveis, Máquinas e Equipamentos (Matl Permanente)",085837652022,"Aquisição com Instalação/Montagem de Equipamento de telecomunicação, de Diagnóstico e Médico/Apoio Assistencial para o HRVJ.",0.0,2024-12-30T00:00:00.000-03:00,Sem Pltrb,Sem DecDisp,Sem DecInexg,,2022/25213,01. PROCESSO LICITATÓRIO,23.453.855/0001-73,78/2024,99458.0,0.0,99458.0,0.0,2024-02-15T13:01:17.446-03:00,2025-10-01T15:03:29.535-03:00,782024,0.0,0.0,99458.0,99458.0,contrato,0,00011639,,23453855000173,VENCIDO,2024-02-16T00:00:00.000-03:00,M.F.A. AGUIAR - EPP,203041,2025-02-17,2025-02-16T00:00:00.000-03:00,2024-02-16T00:00:00.000-03:00,,False,ANA KÉZIA CUNHA DE QUEIROZ ARAÚJO,0001-01-01,1380,False,,,Anita Ludmila Leda Batista Rolim
540854,240001,292914,240401,24200004,24000000,PREGÃO ELETRÔNICO,"AQUISIÇÃO: TACROLIMO, 5MG, CAPSULA. PARA ATENDER AS UNIDADES DE SAÚDE DO ESTADO",DESPESA.SEM.INSTRUMENTO.CONTRATUAL,Sem Íntegra,2024-01-26 00:00:00-03:00,2025-01-03 09:15:06-03:00,2024-12-31 00:00:00-03:00,52,443614,1303963,24001.004859/2024-21,164400.0,0,1795,Outros,114860662022,PARA ATENDER AS UNIDADES DE SAÚDE DO ESTADO,0.0,,Sem Pltrb,Sem DecDisp,Sem DecInexg,,2022/32473,19. REGISTRO DE PREÇO,09.053.134/0001-45,,164400.0,0.0,164400.0,0.0,2024-01-26T13:02:47.351-03:00,2025-05-21T10:30:40.090-03:00,,0.0,0.0,164400.0,164400.0,contrato,0,00292914,,09053134000145,VENCIDO,,ELFA MEDICAMENTOS LTDA,203041,2025-01-01,2024-12-31T00:00:00.000-03:00,2024-01-26T00:00:00.000-03:00,,False,,,187,False,,,
541205,241321,850880,241321,24200234,24000000,PREGÃO ELETRÔNICO,"AQUISIÇÃO DE DESINFETANTE, LIQUIDO, CLORADO, DESINFECCAO E DESCONTAMINACAO DE SUPERFICIES, A BASE DE HIPOCLORITO DE SODIO.",DESPESA.SEM.INSTRUMENTO.CONTRATUAL,Sem Íntegra,2024-01-26 00:00:00-03:00,2025-01-03 09:15:06-03:00,2024-12-31 00:00:00-03:00,52,648283,1304408,24001.038835/2023-95,8100.0,0,581,Material de Limpeza,051426442022,SEM JUSTIFICATIVA DEVIDO AO CONTRATO SER DE DESPESA SEM INSTRUMENTO CONTRATUAL.,0.0,,Sem Pltrb,Sem DecDisp,Sem DecInexg,,2022/00069,19. REGISTRO DE PREÇO,17.602.864/0001-86,,8100.0,0.0,8100.0,0.0,2024-02-01T13:04:15.888-03:00,2025-05-21T10:30:42.597-03:00,,0.0,0.0,8100.0,8100.0,contrato,0,00850880,,17602864000186,VENCIDO,,DELTA INDUSTRIA E COMERCIO LTDA,321254,2025-01-01,2024-12-31T00:00:00.000-03:00,2024-01-26T00:00:00.000-03:00,,False,,,511,False,,,
541327,241321,895185,241321,24200234,24000000,PREGÃO ELETRÔNICO,"AQUISIÇÃO DE HIPOCLORITO DE SODIO, RECIPIENTE PLASTICO, ROTULO CONTENDO DADOS DE IDENTIFICACAO.",DESPESA.SEM.INSTRUMENTO.CONTRATUAL,Sem Íntegra,2024-01-26 00:00:00-03:00,2025-01-03 09:15:06-03:00,2024-12-31 00:00:00-03:00,52,688158,1304496,24001.002711/2024-52,904.8,0,581,Material de Limpeza,051426442022,SEM JUSTIFICATIVA DEVIDO AO CADASTRO SER DE DESPESA SEM INSTRUMENTO CONTRATUAL.,0.0,,Sem Pltrb,Sem DecDisp,Sem DecInexg,,2022/00069,19. REGISTRO DE PREÇO,40.476.824/0001-57,,904.8,0.0,904.8,0.0,2024-02-02T13:04:55.342-03:00,2025-05-21T10:30:43.591-03:00,,0.0,0.0,904.8,904.8,contrato,0,00895185,,40476824000157,VENCIDO,,FORNECER COMERCIO E SERVICOS LTDA,321254,2025-01-01,2024-12-31T00:00:00.000-03:00,2024-01-26T00:00:00.000-03:00,,False,,,633,False,,,
541270,241321,785144,241321,24200234,24000000,PREGÃO ELETRÔNICO,"AQUISIÇÃO DE CAIXA ARQUIVO, POLIONDA, CORES DIVERSAS, POLIETILENO, DIMENSOES 360X250X135MM.",DESPESA.SEM.INSTRUMENTO.CONTRATUAL,Sem Íntegra,2024-01-26 00:00:00-03:00,2025-01-03 09:15:06-03:00,2024-12-31 00:00:00-03:00,52,567498,1304562,24001.002780/2024-66,2187.5,0,581,Material de Expediente,112206762021,SEM JUSTIFICATIVA DEVIDO AO CONTRATO SER DE DESPESA SEM INSTRUMENTO CONTRATUAL.,0.0,,Sem Pltrb,Sem DecDisp,Sem DecInexg,,2021/25304,19. REGISTRO DE PREÇO,18.868.944/0001-40,,2187.5,0.0,2187.5,0.0,2024-02-02T13:04:14.624-03:00,2025-05-21T10:30:43.097-03:00,,0.0,0.0,2187.5,2187.5,contrato,0,00785144,,18868944000140,VENCIDO,,ZAPP COMERCIO DE INFORMATICA E SERVICOS LTDA ,321254,2025-01-01,2024-12-31T00:00:00.000-03:00,2024-01-26T00:00:00.000-03:00,,False,,,576,False,,,
542692,310601,820715,310601,31200006,31000000,DISPENSA,AQUISIÇÃO DE SERVIÇOS DE TERCEIROS - FRETES E TRANSPORTES DE ENCOMENDAS,CONTRATO,20240207.1305124.Integra.CONTRATO.pdf,2024-01-26 00:00:00-03:00,2025-09-26 11:00:07-03:00,2024-05-21 00:00:00-03:00,51,614912,1305124,31042.000592/2023-00,47000.0,0,4089,Outros,31042000592202300,Justifica-se a presente aquisição pela necessidade de atendimento as coletas de materiais e de atendimento as demandas programadas nos prazos estabelecidos em contratos.,0.0,0001-01-01T00:00:00.000-02:34,Sem Pltrb,20240207.1305124.Declaracao.Dispensa.CONTRATO.pdf,Sem DecInexg,,2023/29737,01. PROCESSO LICITATÓRIO,18.078.753/0001-85,013/2023,47000.0,0.0,47000.0,0.0,2024-02-20T13:03:20.051-03:00,2025-10-01T15:08:51.693-03:00,0132023,0.0,0.0,46995.31,46995.31,contrato,0,00820715,,18078753000185,VENCIDO,2024-02-21T00:00:00.000-03:00,COMERCIAL E SERVIÇO SÃO CRISTOVAO EIRELI ,203196,2025-09-24,2024-05-21T00:00:00.000-03:00,2024-02-21T00:00:00.000-03:00,,False,RAIMUNDO NONATO GOMES,,1806,False,,,ROSA FERREIRA ARAÚJO DE ABREU
541236,241321,72322,241321,24200234,24000000,PREGÃO ELETRÔNICO,"AQUISIÇÃO DE PAPEL ALUMINIO - LAMINADO, ALUMINIO, 45,0 CM X 7,5 M, ROLO 7.5 METRO.",DESPESA.SEM.INSTRUMENTO.CONTRATUAL,Sem Íntegra,2024-01-26 00:00:00-03:00,2025-01-03 09:15:06-03:00,2024-12-31 00:00:00-03:00,52,88144,1304572,24001.002732/2024-78,717.0,0,581,Outros,112206762021,SEM JUSTIFICATIVA DEVIDO AO CONTRATO SER DE DESPESA SEM INSTRUMENTO CONTRATUAL.,0.0,,Sem Pltrb,Sem DecDisp,Sem DecInexg,,2021/25304,19. REGISTRO DE PREÇO,40.764.896/0001-08,,717.0,0.0,717.0,0.0,2024-02-02T13:01:36.241-03:00,2025-05-21T10:30:42.841-03:00,,0.0,0.0,717.0,717.0,contrato,0,00072322,,40764896000108,VENCIDO,,PROLIMP  PRODUTOS E SERVIÇOS EIRELI EPP,321254,2025-01-01,2024-12-31T00:00:00.000-03:00,2024-01-26T00:00:00.000-03:00,,False,,,542,False,,,
542234,241301,7776,241301,24200194,24000000,PREGÃO ELETRÔNICO,"Adesão procedente da Ata de Registro de Preço nº 2023/29918, Instrumento convocatório nº 2023/0402, Ordem de Compra nº 02038/2024, cujo o objeto é aquisição de material médico hospitalar e Ambulatorial para atender as necessidades do HGCC.",DESPESA.SEM.INSTRUMENTO.CONTRATUAL,Sem Íntegra,2024-01-26 00:00:00-03:00,2025-01-03 09:15:06-03:00,2024-12-31 00:00:00-03:00,52,27451,1305640,24001.005345/2024-93,3218.0,0,577,Outros,112264552022,"Esta aquisição é de extrema necessidade para o HGCC, que aderiu esta Ata de Registro de Preços, para dar continuidade de forma eficiente e eficaz, aos serviços desta unidade hospitalar.",0.0,,Sem Pltrb,Sem DecDisp,Sem DecInexg,,2022/32740,19. REGISTRO DE PREÇO,61.418.042/0001-31,,3218.0,0.0,3218.0,0.0,2024-02-15T13:01:39.743-03:00,2025-05-21T10:30:49.446-03:00,,0.0,0.0,3218.0,3218.0,contrato,0,00007776,,61418042000131,VENCIDO,,CIRURGICA FERNANDES - COMÉRCIO DE MATERIAIS CIRÚRGICOS E HOSPITALARES LTDA,321260,2025-01-01,2024-12-31T00:00:00.000-03:00,2024-01-26T00:00:00.000-03:00,,False,,,1390,False,,,
542419,241301,168635,241301,24200194,24000000,PREGÃO ELETRÔNICO,"Adesão procedente da Ata de Registro de Preço nº 2023/20671, Instrumento convocatório nº 2023/0288, Ordem de Compra nº 01966/2024, cujo o objeto é aquisição de material médico hospitalar e Ambulatorial para atender as necessidades do HGCC.",DESPESA.SEM.INSTRUMENTO.CONTRATUAL,Sem Íntegra,2024-01-26 00:00:00-03:00,2025-01-03 09:15:06-03:00,2024-12-31 00:00:00-03:00,52,174282,1305859,24001.005347/2024-82,27500.0,0,577,Outros,106798392022,"Esta aquisição é de extrema necessidade para o HGCC, que aderiu esta Ata de Registro de Preços, para dar continuidade de forma eficiente e eficaz, aos serviços desta unidade hospitalar.",0.0,,Sem Pltrb,Sem DecDisp,Sem DecInexg,,2022/32185,19. REGISTRO DE PREÇO,66.437.831/0001-33,,27500.0,0.0,27500.0,0.0,2024-02-17T13:04:11.571-03:00,2025-05-21T10:30:50.420-03:00,,0.0,0.0,27500.0,27500.0,contrato,0,00168635,,66437831000133,VENCIDO,,HTS TECNOLOGIA EM SAUDE COM IMP E EXPORT,321260,2025-01-01,2024-12-31T00:00:00.000-03:00,2024-01-26T00:00:00.000-03:00,,False,,,1548,False,,,
541633,460101,939864,460801,46200008,46000000,DISPENSA,"PARA ATENDER DEMANDA JUDICIAL N°3037248-98.2023.8.06.0001 REFERENTE TRATAMENTO COM MEDICAMNETOS DOXORRUBICINA, CICLOSFAMIDA, FILGRASTIM, CARBOPLATINA E PACLITAXEL PRESCRITOS CONFORME LAUDO MÉDICO ÉM FAVOR DA USUARIA  LENI POMPEU DE PAULA",DESPESA.SEM.INSTRUMENTO.CONTRATUAL,20240202.1303964.Declaracao.Dispensa.DESPESA.SEM.INSTRUMENTO.CONTRATUAL.pdf,2024-01-26 00:00:00-03:00,2025-01-03 09:15:06-03:00,2024-12-31 00:00:00-03:00,52,720371,1303964,11120284/2023,40683.9,0,3610,Outros,111202842023,"PARA ATENDER DEMANDA JUDICIAL N°3037248-98.2023.8.06.0001 REFERENTE TRATAMENTO COM MEDICAMNETOS DOXORRUBICINA, CICLOSFAMIDA, FILGRASTIM, CARBOPLATINA E PACLITAXEL PRESCRITOS CONFORME LAUDO MÉDICO ÉM FAVOR DA USUARIA  LENI POMPEU DE PAULA",0.0,,Sem Pltrb,20240202.1303964.Declaracao.Dispensa.DESPESA.SEM.INSTRUMENTO.CONTRATUAL.pdf,Sem DecInexg,,2023/30704,01. PROCESSO LICITATÓRIO,01.873.957/0003-77,,40683.9,0.0,40683.9,0.0,2024-02-06T13:04:39.883-03:00,2025-06-26T13:58:16.531-03:00,,0.0,0.0,40683.9,38044.48,contrato,0,00939864,,01873957000377,VENCIDO,,SUPORTE NUTRICIONAL E QUIMIOTARAPIA LTDA,395270,2025-01-01,2024-12-31T00:00:00.000-03:00,2024-01-26T00:00:00.000-03:00,,False,,,917,True,8666,,
541598,460101,176513,460801,46200008,46000000,DISPENSA,PARA ATENDER DEMANDA JUDICIAL N°3036593-29.2023.8.06.0001 REFERENTE EXAME PET SCAN COM PSMA CONFORME LAUDO MÉDICO EM FAVOR DO USUÁRIO JOSE ROCHA LIMA,DESPESA.SEM.INSTRUMENTO.CONTRATUAL,20240202.1303962.Declaracao.Dispensa.DESPESA.SEM.INSTRUMENTO.CONTRATUAL.pdf,2024-01-26 00:00:00-03:00,2025-01-03 09:15:06-03:00,2024-12-31 00:00:00-03:00,52,180531,1303962,10932137/2023,7000.0,0,3610,Outros,109321372023,PARA ATENDER DEMANDA JUDICIAL N°3036593-29.2023.8.06.0001 REFERENTE EXAME PET SCAN COM PSMA CONFORME LAUDO MÉDICO EM FAVOR DO USUÁRIO JOSE ROCHA LIMA,0.0,,Sem Pltrb,20240202.1303962.Declaracao.Dispensa.DESPESA.SEM.INSTRUMENTO.CONTRATUAL.pdf,Sem DecInexg,,2023/30929,01. PROCESSO LICITATÓRIO,04.844.523/0001-75,,7000.0,0.0,7000.0,0.0,2024-02-06T13:04:11.286-03:00,2025-06-26T13:58:19.524-03:00,,0.0,0.0,7000.0,7000.0,contrato,0,00176513,,04844523000175,VENCIDO,,OMNIMAGEM MILLENIUM DIAG IMAGEM TR TERAP,395270,2025-01-01,2024-12-31T00:00:00.000-03:00,2024-01-26T00:00:00.000-03:00,,False,,,882,True,8666,,
541040,300001,792903,300001,30000000,30000000,PREGÃO ELETRÔNICO,"Aquisição de Material de Consumo ¿ Limpeza (Higiene e Desinfecção), cujas especificações e quantitativos encontram-se detalhados no Anexo I ¿ Termo de Referência do edital de Pregão Eletrônico nº 20220042/SEPLAG, para atender a demanda da Casa Civil.",DESPESA.SEM.INSTRUMENTO.CONTRATUAL,Sem Íntegra,2024-01-26 00:00:00-03:00,2025-01-03 09:15:06-03:00,2024-12-31 00:00:00-03:00,52,580455,1304190,30001.000311/2024-13,1785.0,0,1772,Material de Limpeza,46001002893202232,para atender a demanda da Casa Civil.,0.0,,Sem Pltrb,Sem DecDisp,Sem DecInexg,,2022/30709,19. REGISTRO DE PREÇO,16.970.003/0001-98,,1785.0,0.0,1785.0,0.0,2024-01-31T13:03:56.539-03:00,2025-05-21T10:30:41.306-03:00,,0.0,0.0,1785.0,1785.0,contrato,0,00792903,,16970003000198,VENCIDO,,JPJ COMERCIO VAREJISTA DE MATERIAL DE ESCRITORIO LTDA,203172,2025-01-01,2024-12-31T00:00:00.000-03:00,2024-01-26T00:00:00.000-03:00,,False,,,369,False,,,
542157,241311,827904,241311,24200204,24000000,PREGÃO ELETRÔNICO,"Adesão a Ata de Registro de Preço n° 6174/2023, Pregão Eletrônico n° 1278/2022, cujo objeto é a aquisição de material médico hospitalar, para o HIAS",DESPESA.SEM.INSTRUMENTO.CONTRATUAL,Sem Íntegra,2024-01-26 00:00:00-03:00,2025-01-03 09:15:06-03:00,2024-12-31 00:00:00-03:00,52,623509,1305473,24001.006661/2024-82,3748.8,0,578,Outros,029535012022,"Sem justificativa, devido ao cadastro ser de despesa sem instrumento contratual.",0.0,,Sem Pltrb,Sem DecDisp,Sem DecInexg,,2022/11197,19. REGISTRO DE PREÇO,20.301.535/0001-00,,3748.8,0.0,3748.8,0.0,2024-02-10T13:06:38.693-03:00,2025-05-21T10:30:48.976-03:00,,0.0,0.0,3748.8,3748.8,contrato,0,00827904,,20301535000100,VENCIDO,,JB FARMA COMERCIO DE MEDICAMENTOS E REPRESENTACOES EIRELI,321251,2025-01-01,2024-12-31T00:00:00.000-03:00,2024-01-26T00:00:00.000-03:00,,False,,,1317,False,,,
541634,460101,938251,460801,46200008,46000000,DISPENSA,PARA ATENDER DEMANDA JUDICIAL N°0280524-86.2022.8.06.0001 REFERENTE TRATAMENTO DE SESSÕES DE PRESSÃO NEGATIVA- ESTOMATOTERAPIA NOS TERMOS DO LAUDO MÉDICO EM FAVOR DE CARLOS AUGUSTO HOLANDA BARBOSA,DESPESA.SEM.INSTRUMENTO.CONTRATUAL,20240202.1303966.Declaracao.Dispensa.DESPESA.SEM.INSTRUMENTO.CONTRATUAL.pdf,2024-01-26 00:00:00-03:00,2025-01-03 09:15:06-03:00,2024-12-31 00:00:00-03:00,52,718538,1303966,10910583/2023,115000.0,0,3610,Outros,109105832023,PARA ATENDER DEMANDA JUDICIAL N°0280524-86.2022.8.06.0001 REFERENTE TRATAMENTO DE SESSÕES DE PRESSÃO NEGATIVA- ESTOMATOTERAPIA NOS TERMOS DO LAUDO MÉDICO EM FAVOR DE CARLOS AUGUSTO HOLANDA BARBOSA,0.0,,Sem Pltrb,20240202.1303966.Declaracao.Dispensa.DESPESA.SEM.INSTRUMENTO.CONTRATUAL.pdf,Sem DecInexg,,2023/30731,01. PROCESSO LICITATÓRIO,27.860.771/0001-05,,115000.0,0.0,115000.0,0.0,2024-02-06T13:04:40.773-03:00,2025-06-26T13:58:16.543-03:00,,0.0,0.0,115000.0,115000.0,contrato,0,00938251,,27860771000105,VENCIDO,,INSTITUTO DE ESTOMATERAPIA E PODIATRIA DE FORTALEZA,395270,2025-01-01,2024-12-31T00:00:00.000-03:00,2024-01-26T00:00:00.000-03:00,,False,,,918,True,8666,,
541929,241311,881744,241311,24200204,24000000,PREGÃO ELETRÔNICO,"Adesão a Ata de Registro de Preço n° 00177/2024, Pregão Eletrônico n° 1367/2023, cujo objeto é a aquisição de material médico hospitalar - ( AGULHA VERESS E ESPECULO VAGINAL), para o HIAS",DESPESA.SEM.INSTRUMENTO.CONTRATUAL,Sem Íntegra,2024-01-26 00:00:00-03:00,2025-01-03 09:15:06-03:00,2024-12-31 00:00:00-03:00,52,673104,1305182,24001.006657/2024-14,960.0,0,578,Outros,008582342022,"Sem justificativa, devido ao cadastro ser de despesa sem instrumento contratual.",0.0,,Sem Pltrb,Sem DecDisp,Sem DecInexg,,2022/20318,19. REGISTRO DE PREÇO,14.361.780/0002-90,,960.0,0.0,960.0,0.0,2024-02-08T13:03:38.743-03:00,2025-05-21T10:30:47.583-03:00,,0.0,0.0,960.0,960.0,contrato,0,00881744,,14361780000290,VENCIDO,,MEDICAL LIFE COMERCIO DE PRODUTOS HOSPITALARES LTDA,321251,2025-01-01,2024-12-31T00:00:00.000-03:00,2024-01-26T00:00:00.000-03:00,,False,,,1117,False,,,
540867,241281,839008,241281,24200184,24000000,PREGÃO ELETRÔNICO,"AQUISIÇÃO DE MATERIAL TECNICO HOSPITALAR - KBOLSA, PARA NUTRICAO PARENTERAL, 500ML; BOLSA, PARA NUTRICAO PARENTERAL, 2000ML - PARA ATENDER AS NECESSIDADES DO HOSPITAL GERAL DE FORTALEZA.",DESPESA.SEM.INSTRUMENTO.CONTRATUAL,Sem Íntegra,2024-01-26 00:00:00-03:00,2025-01-03 09:15:06-03:00,2024-12-31 00:00:00-03:00,52,637485,1303994,24001.001683/2024-56,58095.0,0,576,Outros,054934472022,PARA ATENDER AS NECESSIDADES DO HOSPITAL GERAL DE FORTALEZA.,0.0,,Sem Pltrb,Sem DecDisp,Sem DecInexg,,2022/16182,19. REGISTRO DE PREÇO,31.673.254/0010-95,,58095.0,0.0,58095.0,0.0,2024-01-28T09:00:06.871-03:00,2025-05-21T10:30:40.196-03:00,,0.0,0.0,58095.0,58095.0,contrato,0,00839008,,31673254001095,VENCIDO,,LABORATORIOS BBRAUN SA,321261,2025-01-01,2024-12-31T00:00:00.000-03:00,2024-01-26T00:00:00.000-03:00,,False,,,200,False,,,
541618,241301,855273,241301,24200194,24000000,PREGÃO ELETRÔNICO,"Adesão procedente da Ata de Registro de Preço nº 2022/14663, Instrumento convocatório nº 2022/1756, Ordem de Compra nº 01795/2024, cujo o objeto é aquisição de material médico hospitalar e Ambulatorial para atender as necessidades do HGCC.",DESPESA.SEM.INSTRUMENTO.CONTRATUAL,Sem Íntegra,2024-01-26 00:00:00-03:00,2025-01-03 09:15:06-03:00,2024-12-31 00:00:00-03:00,52,649392,1304792,24001.005433/2024-95,5274.72,0,577,Outros,045844142022,"Esta aquisição é de extrema necessidade para o HGCC, que aderiu esta Ata de Registro de Preços, para dar continuidade de forma eficiente e eficaz, aos serviços desta unidade hospitalar.",0.0,,Sem Pltrb,Sem DecDisp,Sem DecInexg,,2022/14663,19. REGISTRO DE PREÇO,02.814.280/0002-88,,5274.72,0.0,5274.72,0.0,2024-02-06T13:04:32.634-03:00,2025-05-21T10:30:45.940-03:00,,0.0,0.0,5274.72,5274.72,contrato,0,00855273,,02814280000288,VENCIDO,,CIENLABOR INDÚSTRIA E COMÉRCIO LTDA.,321260,2025-01-01,2024-12-31T00:00:00.000-03:00,2024-01-26T00:00:00.000-03:00,,False,,,902,False,,,
541333,241321,874170,241321,24200234,24000000,PREGÃO ELETRÔNICO,"AQUISIÇÃO DE BARBANTE, 50 FIOS, NATURAL DE SISAL, DIMENSAO 50M, EMBALAGEM COM IDENTIFICACAO DO PRODUTO, MARCA DO FABRICANTE, AVULSO 1.0 ROLO.",DESPESA.SEM.INSTRUMENTO.CONTRATUAL,Sem Íntegra,2024-01-26 00:00:00-03:00,2025-01-03 09:15:06-03:00,2024-12-31 00:00:00-03:00,52,662422,1304568,24001.002785/2024-99,115.29,0,581,Material de Expediente,112206762021,SEM JUSTIFICATIVA DEVIDO AO CONTRATO SER DE DESPESA SEM INSTRUMENTO CONTRATUAL.,0.0,,Sem Pltrb,Sem DecDisp,Sem DecInexg,,2021/25304,19. REGISTRO DE PREÇO,33.651.718/0001-05,,115.29,0.0,115.29,0.0,2024-02-02T13:04:57.923-03:00,2025-05-21T10:30:43.644-03:00,,0.0,0.0,115.29,115.29,contrato,0,00874170,,33651718000105,VENCIDO,,W R COMERCIO DE MATERIAIS DE LIMPEZA LTDA,321254,2025-01-01,2024-12-31T00:00:00.000-03:00,2024-01-26T00:00:00.000-03:00,,False,,,639,False,,,
541806,241311,834208,241311,24200204,24000000,PREGÃO ELETRÔNICO,"Adesão a Ata de Registro de Preço n° 16091/2023, Pregão Eletrônico n° 33/2022, cujo objeto é a aquisição de material de consumo - LIMPEZA RODOS E DIVERSOS, para o HIAS",DESPESA.SEM.INSTRUMENTO.CONTRATUAL,Sem Íntegra,2024-01-26 00:00:00-03:00,2025-01-03 09:15:06-03:00,2024-12-31 00:00:00-03:00,52,631244,1305001,24001.004983/2024-97,2071.4,0,578,Material de Limpeza,078676622022,"Sem justificativa, devido ao cadastro ser de despesa sem instrumento contratual.",0.0,,Sem Pltrb,Sem DecDisp,Sem DecInexg,,2022/18772,19. REGISTRO DE PREÇO,26.230.868/0001-71,,2071.4,0.0,2071.4,0.0,2024-02-07T13:04:05.383-03:00,2025-05-21T10:30:46.918-03:00,,0.0,0.0,2071.4,2071.4,contrato,0,00834208,,26230868000171,VENCIDO,,BRILHARES PRODUTOS DE LIMPEZA LTDA ,321251,2025-01-01,2024-12-31T00:00:00.000-03:00,2024-01-26T00:00:00.000-03:00,,False,,,1019,False,,,
